Index,Article Title,URL,Author,Content,Date,Think Tank,Matched Keywords
1,"The Rise of Sweden Democrats: Islam, Populism and the End of Swedish Exceptionalism",https://www.brookings.edu/articles/the-rise-of-sweden-democrats-and-the-end-of-swedish-exceptionalism/,Danielle Lee Tomson,"Historically, Sweden has been a generous safe haven for refugees. Of all the countries featured in this Brookings project, it has taken in the most refugees per capita, and is third in the world on this measure behind Canada and Australia.1 In 2015, Sweden had a record-high of 162,877 applications for asylum, primarily from Syria, Iraq, and Afghanistan—or about 1.6 percent of Sweden’s population of 10 million.2 This would be proportionally equivalent to over five million people applying for asylum in the United States, which in fact only received approximately 83,000 asylum applications that year.3

For a country like Sweden that has grown increasingly secular over recent decades, the influx of Muslims from war-torn countries has greatly impacted politics and society. The Sweden Democrats (Sverigedemokraterna), a right-wing populist party once politically verboten because of ties to neo-Nazis at its founding in 1988, is now the third largest party in the Riksdag, the Swedish parliament. It has effectively fashioned a narrative linking the surge of predominantly Muslim immigrants to a perception of an uptick in violent crimes and perceived strains on the prized Swedish welfare system. Swedes who are disgruntled by “the establishment” response to these concerns, especially regarding sociocultural issues,4 are attracted to the populist refrain of the Sweden Democrats: “We say what you think.”5 Unsurprisingly, the Sweden Democrats’ primary talking point is to specifically halt asylum immigration, which is predominantly Muslim.

This case study offers insight into why Swedes are joining the Sweden Democrats and the connection to their perception of Islam. Through interviews with Sweden Democrat voters and officials primarily in Skåne, the southern party stronghold, this paper provides an intimate portrait of Sweden Democrats and their frustration with a political establishment over Muslim immigration, the perceived impact on the welfare system, and the cultural fallout in secular, liberal Sweden.6 Interviewees eagerly shared their experiences of changes in Sweden, such as the introduction of Muslim children joining their kids’ classes, witnessing crimes in neighborhoods with more immigrants, and experiencing what they think of as religious concessions for Muslims who “should” be assimilating to secular Sweden.

Sweden Democrats do not believe that problems of crime or integration stem primarily from failures of socioeconomic policy or government bureaucracy; rather, they also blame culture, both of Muslim immigrants and political correctness. The Sweden Democrats and their robust network of “alternative media”7 offer narratives that make sense of these phenomena, regardless of whether claims might be unverified or false. When faced with allegations of racism, however, Sweden Democrats double down on the populist message that they are normal, working-class people trying to call attention to socioeconomic and sociocultural challenges posed by an influx of non-Western refugees, which they claim traditional political parties do not tackle head-on.

To understand the rise of the Sweden Democrats, it is important to first consider how the party exists in opposition to Sweden’s pre-existing political landscape, which had been governed more or less by a centrist consensus emphasizing humanitarianism and social welfare. The current ruling party, the Social Democrats, has been in power for the better part of the twentieth century with the exception of a few election cycles. Under the idea of folkhemmet or creating a “people’s home,” the Social Democrats in the 1930s were responsible for setting up much of Sweden’s robust social welfare system. It is the oldest party in Sweden and is currently leading the government in coalition with the Green Party.8

The second largest party is the Moderates, a center-right party and the main opposition to the Social Democrats. They differ from the latter in their support for free market principles, economic liberalism, and tax cuts. From 2006 to 2014 they were the lead party in coalition with the Christian Democrats, Liberals, and Center Party. Yet when the Sweden Democrats became the Riksdag’s third largest party in 2018, this coalition split, with the Liberals and Center Party offering support to the Social Democrats and refusing to make common cause with the Sweden Democrats to form a conservative government.9

There is a proud national narrative of “Swedish Exceptionalism” for welcoming refugees and providing asylum. While Swedes might have guarded their ethnic homogeneity before the 1930s, by World War II, Sweden began accepting Norwegian, Jewish, Danish, and Estonian immigrants.10 In the decades following, they welcomed Iranians after the Islamic revolution, Chileans fleeing Pinochet, and war refugees from the former Yugoslavia. Being a safe haven for others became a point of pride.11 As other European countries moved toward stricter immigration policies in the 1990s and 2000s, Sweden opened up.12 With some exceptions, politicians on both the left and right supported generous asylum and immigration policies well above the EU-minimum standards.13

All of this changed with the refugee crisis of 2015, marking the “end of Swedish exceptionalism,” when political parties changed their rhetoric and policies in reaction to fears of a “system collapse” from the massive influx of migrants.14 By November 2015, even the Social Democrat Prime Minister Stefan Löfven noted, “It pains me that Sweden is no longer capable of receiving asylum seekers at the high level we do today. We simply cannot do any more,” the near opposite of what he said just seven months before.15 By this time however, the Sweden Democrats had already seized the opportunity to position themselves as the only “authentic” party calling for curbing immigration not just recently but for decades.

It was against a backdrop of de-industrialization, public spending cutbacks, rising unemployment, and the violent breakup of Yugoslavia that caused an influx of refugees, that the Swedish Democrats grew up after their founding in 1988.16 Like other radical right parties, they called for restricting immigration across the board, not just of Muslims.17 Initially, the party had connections to Swedish fascism and explicit white nationalism.18 They elected Anders Klarström as party chairman in 1989, who had been linked to the neo-Nazi Nordic Realm Party.19 After photos surfaced of some members wearing Nazi uniforms in the mid-1990s, the party banned the wearing of uniforms of any kind and explicitly denounced Nazism in an attempt to present a more respectable image.20

Most of my interviewees acknowledged the racist origins of the Sweden Democrats but insisted that the party had outgrown them. A party official and Iranian immigrant who joined in 2013 rejected claims of racism, despite his own initial fears to the contrary: “I was afraid that when I became a member, when I was coming to party headquarters in Malmö, I was expecting like, oh, will there be a Southern Dixie Flag. But I came here and there was coffee and cookies and there was nothing like that.”21 Other respondents claimed that while extremists still sometimes showed up to local Sweden Democrat meetings, they were summarily expelled. A few interviewees shrugged off the party’s past or denied pieces of it, saying that political adversaries draw attention to the racist past to delegitimize the party.

Despite dark origins, the Sweden Democrats have surged both in Riksdag seats and in public opinion polls. In the 2018 Riksdag election, the Sweden Democrats gained 13 seats for a total of 62, while the Social Democrats lost 13 seats, dropping to 100.22 Since 2014, the Sweden Democrats have been the third largest party in parliament.23 Particularly in the southern Skäne region, Sweden Democrats have made up the largest party in 21 of the region’s 33 municipalities since 2018.24 During the writing of this paper, the Sweden Democrats tailed the Social Democrats as most popular among voters in opinion polls, at one point besting them with 24 percent of support, compared to the Social Democrats at 22 percent.25

Why the increased popularity? Scholars Anders Hellström, Tom Nilsson, and Pauline Stoltz describe three phases of the Sweden Democrats’ development. The first was before 2006, when the party was more or less out of public view and perceived as a small movement with neo-Nazi flourishes. In 2005, the 26-year-old chairman of the Sweden Democratic Youth, Jimmie Åkesson became the party leader, a position he still holds today. A former web developer and ex-Moderate, Åkesson strove to change the party’s image after various neo-Nazi leaders were expelled.26 The change in leadership arguably ushered the party into a second stage (2006-2010), pushing it away from openly racist groups and toward a populist message advocating for “ordinary people” against a corrupt elite at the height of a global recession. This catapulted the Swedish Democrats into the media and public consciousness and gave the party its first significant electoral gains. The third phase came in 2010, when they entered parliament for the first time with 20 seats.27 The party officially changed its self description from “nationalist” to “social conservative” in 2011, and in 2012 introduced a “zero tolerance for racism” policy, which expelled party members with public opinions deemed as too racist.28

Notably, anti-Islam and anti-Muslim sentiments were not included in this expulsion. The Sweden Democrats had been laying the groundwork for a more focused anti-Islam narrative long before 2015, identifying Islam as public enemy number one. Åkesson claimed in 2009, “As a Sweden Democrat I see this [Islam and Muslims in Sweden] as our biggest foreign threat since World War II…Leading representatives of the Muslim community will demand the implementation of Sharia law in Sweden; that the Swedish municipal health board would use taxes to circumcise totally healthy young boys; that Sweden would have a higher level of rape and that Muslim men would be strongly represented among the rapists; that Swedish swimming clubs would introduce separate timetables for women and men.”29

These warnings about Islam from Åkesson’s 2009 speech, such as rape by migrants and religiously segregated swimming pools, came up in many interviews, despite most interviewees only joining the party in the past five to seven years. Survey research shows that Sweden Democrats have significantly different opinions of Muslims than those in other parties. According to recent Pew Research Center polls, 59 percent of Swedes with a positive opinion of the Sweden Democrats express an unfavorable opinion of Muslims in their country. Conversely of those with a negative view of the Sweden Democrats, just 17 percent see Muslims negatively.30 Of Swedes, 70 percent had favorable attitudes toward immigration in 2015, yet Sweden Democrats’ higher skepticism toward immigration has framed it as an increasingly important political issue.31

Building on Hellstöm, Nilsson, and Stoltz, I suggest there is a fourth phase in the party’s evolution, marked by the 2015 refugee crisis. In a span of three months, 114,000 predominantly Muslim asylum seekers arrived in Sweden, primarily into Malmö and small towns in the South, overwhelming the capacity of both government and civil society organizations while garnering continuous media attention.32","March 25, 2020",Brookings Institution,racial prejudice
2,The George Zimmerman Trial: Virtues of an Acquittal,https://www.brookings.edu/articles/the-george-zimmerman-trial-virtues-of-an-acquittal/,Richard Lempert,"The bottom line is that a boy, on the cusp of manhood, is dead; his only crime: wearing a hoodie while going out to buy a can of soda. Everything that followed is a footnote. There is nothing to celebrate here. The man who killed him is acquitted, although he behaved badly, ignored what the police told him, and appears to have been motivated by racial stereotypes if not racial hatred. He may also, in fact, have committed murder in the second degree or manslaughter, but he will not serve time if he has. Yet his trial and the verdict are not without their virtues.

Chief among them is that legal justice has been done. It is easy to construct scenarios consistent with a guilty George Zimmerman. We have only Zimmerman’s word that Trayvon Martin turned on him or ambushed him, yet he refused to tell this tale under oath. Zimmerman’s claim that Martin pounded his head violently and repeatedly against the pavement such that he feared for his life seems inconsistent with the few bumps and scrapes on his head and the absence of any trace of his DNA on Martin’s fingernails, hands or body. If Martin was pounding Zimmerman’s head, he wasn’t aggressive enough to prevent Zimmerman from retrieving his gun and precisely, or with great luck, aiming it directly at Martin’s heart. The defense’s strongest evidence, testimony that Martin was on top of Zimmerman as they struggled, tells little of moment, even if it is accurate. Consider. You turn to confront a man who has been following you and is closing in. You see him reaching for a gun. You lunge at him to stop him from getting it, and your weight pushes him to the ground with you on top. Your position on top as you struggle does not mean you are the aggressor.

But this is all speculation. People cannot and should not be convicted on speculation. The evidence proving George Zimmerman guilty of murder or manslaughter beyond a reasonable doubt wasn’t there, and it doesn’t matter that it wasn’t there because George Zimmerman never took the stand or because there were no eye witnesses or for any other reason. George Zimmerman was not proven guilty of either murder or manslaughter, and the jury, after some deliberation, reached the right result. If there is anything to celebrate about the trial, this is it. The system worked.

Some might argue, as Alan Dershowitz has, that the system did not work; that the case should not have been tried in the first place, and that George Zimmerman was punished by the process regardless of the outcome. Zimmerman certainly suffered from the process, as any acquitted criminal defendant does, and Dershowitz has a point, but I disagree. By the standards of cases prosecutors regularly bring, this is far from the worst in terms of evidential strength and the likelihood of conviction (Half the jury voted to convict on the first ballot). The state could not know how Martin’s girlfriend, their lead witness, would appear on the stand, nor the quality of Zimmerman’s defense. Moreover, the prosecution did not anticipate that on the eve of trial their potentially most persuasive evidence, the forensic testimony that it was Martin who was calling for help just before the shot was fired, would be barred by the judge. Although this decision too appears correct, prosecutors have often been allowed to present shaky forensic evidence.

If in retrospect the verdict acquitting Zimmerman was correct, the decision to try Zimmerman also had substantial virtues. The initial outrage when Florida’s stand your ground law was invoked to set Zimmerman free with no trial and minimal investigation was more than justified. Absolving Zimmerman of responsibility at that point would have meant that when a person killed another with ambiguous forensic evidence and no witnesses about, the killer’s story of what happened, coupled with consistent but minor and possibly self-inflicted injuries, would be enough to allow the killer to go free. The trial not only dampened outrage triggered by a half-hearted police investigation and a local prosecutor’s overly quick willingness to absolve Zimmerman, but the weaknesses in the evidence the state mustered have dampened outrage at seeing Zimmerman walk, even among those who still believe him guilty. The case no longer represents a Southern state’s refusal to take the killing of a black youth seriously, which is what it stood for when the news first broke. Even if there are some who do not accept the verdict, trying Zimmerman enhanced legitimacy.

The trial also highlights a fundamental flaw in stand your ground laws. If there was not enough evidence to prove Zimmerman guilty beyond a reasonable doubt, there was also insufficient evidence to prove him innocent. That an unjustified homicide was not proved does not mean the homicide was justified. The case turned, as criminal cases often do, on the allocation of the burden of proof, an allocation that the defense emphasized in its closing argument. On the facts as we know them either Zimmerman or Martin could have been the first aggressor. Hence under Florida’s stand your ground law, it is possible that both Zimmerman and Martin could reasonably claim to have been standing their ground in that each honestly and reasonably felt his space and person was being invaded by the other in a way that constituted an attack.[1] If Zimmerman had a legal right to follow Martin as he walked home, Martin had a legal right to confront Zimmerman and to tell him to go away. If a fight ensued in which each party attacked the other, the law appears to authorize each to use force, including deadly force, to prevent the assault the other. Had Martin managed to seize Zimmerman’s gun in the struggle and shot him, Martin would have been the person seeking exoneration because he had stood his ground. It is hard to come up with any policy justification for a law which not only authorizes either of two fighters to use deadly violence but also encourages it by overturning prior law that imposed a duty to retreat if retreat was possible. To the extent “stand your ground” protects a deserved right of self-defense, the law of self-defense is, as we saw in Zimmerman’s trial, more than adequate.

The trial may also have had important educational and deterrence functions.  Future George Zimmermans will most likely be more prone to listen to 911 operators who suggest they back off from following someone they regard as suspicious and wait for the police to arrive, and gun toters in altercations may be less likely to think stand your ground laws will protect them if they pull out their guns and fire. Trayvon Martin’s death may well mean that others will live, but no one who owes his life to Martin and to the decision to try Zimmerman will ever know.

When it comes to race, however, the trial did little to advance conversation. Both the prosecution and the defense tip-toed around the race issue, and some of their comments seemed to deny its existence. As a defense strategy this is understandable; acknowledging the possibility that Zimmerman was motivated by racial prejudice and racial stereotyping would have made the second degree murder charge more plausible and reduced the likelihood of juror identification with Zimmerman. The prosecution most likely had its own goals.  Chief among them, I expect, was to prevent the stoking of racial tensions and to minimize the likelihood of violent reactions to the verdict. These aims are understandable, but had the prosecution’s evidence been stronger the concern for extra-trial consequences might have cost them the verdict they sought.  As the audience, however, we should not ignore race.  It is unlikely that Martin would have been followed, much less killed, had he been white.  Zimmerman did not use the N word in talking about the boy he was following or unprompted refer to his race, but he made it clear that he profiled Martin as a useless punk.

Some commentators have tried to defuse racial motivation claims by suggesting that it was Martin’s hoodie rather than his race that caught Zimmerman’s attention and led to his rant. If true, an interesting lesson about contemporary racism can be drawn. We should ask why wearing a hoodie aroused Zimmerman’s suspicion. I expect it is because Zimmerman and others associate hoodies with black youth and see them as the outfit of black gang members. In these imaginations it doesn’t matter that enough hooded sweatshirts have been sold to garb every black gang member hundreds of times over. If the apologists for Zimmerman are to be believed, the association of hoodies with race and violence is so strong even a white youth wearing one would be regarded with suspicion.  Often today, racial disadvantage works this way.  People unknowingly react to race in ways that disadvantage blacks. With no awareness of what they are doing, employers don’t call the woman with a “black name” on her resume for a job interview but interview a white with identical credentials, or they don’t hire a black man who was charged with possessing marihuana and acquitted, but they “give a second chance” to a white man who pled guilty to possession. Real estate agents encourage the white sounding voice on the phone to come look at a rental unit even though the apartment doesn’t have everything they seek, but they tell the black voice that their preferences mean the apartment is not suitable. Police in training shoot more quickly when a black figure makes a possibly hostile movement than when a white figure does the same. Only controlled tests or statistics reveal how race affects the behavior of some, but the same measures reveal that others behave consistently and without discrimination regardless of race. This means that outside of controlled tests, like “race audits,” one seldom knows whether race has played a role in a job hunt failure or the unexpected renting of an apartment a black couple was interested in.  When race effects are inconsistent and subtle and when both the discriminator and the victim have difficulty perceiving the role that race is playing in decisions, it is difficult to eradicate the systematic disadvantages that plague racial minorities. Yet unless society changes to eliminate the hidden vestiges of past racism, the price paid will include more dead Trayvon Martins.

George Zimmerman’s legal troubles are not entirely over. Some are pressuring the Justice Department to charge him with hate crime or other civil rights violations. This would be a mistake. Many would see federal charges as excessive and illegitimate, and some would attribute prosecution to the fact that the President and his Attorney General are black. But even if these perceptions would not exist, federal criminal law should not be invoked. There is always cause for unease when following an acquittal different laws are invoked to punish a person for the behavior evaluated in the first trial. If the evidence was insufficient to justify culpability, the government, even another government invoking different laws, should not get another bite at the apple. An exception for crimes of racial violence is justified when an acquittal appears to have been against the weight of the evidence and motivated by the biases of a local court and/or jury. That is not the case here. The Florida trial was fair, and the judge and jury seemed impartial. The evidence needed to convict was simply not there. Unless persuasive new evidence that Zimmerman committed a crime is uncovered (e.g., Zimmerman brags that he got away with murder) the federal government should let the matter drop.  The same is not necessarily true of Martin’s family. They could bring a civil suit, in which the burden of proof would be less than in a criminal case, and Zimmerman would have to testify. A suit by Martin’s parents has more to commend it, both in its prospects for success and for what it could do to flesh out the picture of what happened. But a civil jury too might find for Zimmerman, and if Zimmerman is likely to leave a civil suit with his image somewhat sullied, the same will be true of Trayvon Martin.  His parents would be wise to avoid the pain of a legally sanctioned assault on their dead son’s character. Best to leave what is in the past past and to concentrate on making things better in the future. The place to begin making things better is with the repeal of Florida’s stand your ground law.","July 18, 2013",Brookings Institution,racial prejudice
