Index,Article Title,URL,Author,Content,Date,Think Tank,Matched Keywords
26,Bowling with Trump,https://www.brookings.edu/articles/bowling-with-trump/,"Mark Fabian, Robert Breunig","Why did Donald Trump win the 2016 Presidential Election? Numerous reasons were canvassed in the aftermath of the result. Among them were the emergent power of social media and fake news (Allcott and Gentzkow 2017), Russian interference (Hall Jamieson 2018), the gap between low and high educated whites (Schaffner et al. 2017), lavish media attention on Trump (Sides et al. 2018), anti-incumbency (ibid.), economic anxiety (Autor et al. 2016), sexism (Valentino et al. 2019), and racism (Hooghe and Dassonneville 2018). In a prominent recent review of the literature and the evidence, Sides et al. (ibid.) acknowledge some role for all these factors but argue that the key force behind Trump’s victory was “racialized economics” and Trump’s willingness and ability to leverage it. Racialized economics is the tendency among some voters to consider economic issues not through an individual lens but through a racial one instead. As Sides et al. (2018, p. 8) explain:

The important sentiment underlying Trump’s support was not “I might lose my job” but, in essence, “people in my group are losing jobs to that other group”. Instead of pure economic anxiety, what mattered was racialized economics.

We quantitatively analyze this hypothesis using a very large dataset—the Gallup Daily Poll—and explicate the psychological roots of racialized economics. We argue that there is a channel from economic shocks to nativist voting via psychological wellbeing. Self-determination theory (SDT, Ryan and Deci 2017), a school of clinical psychology, argues that psychological well-being is a function of three basic psychological needs: for autonomy, competence, and relatedness. When these are thwarted, people will try to compensate. As economic decline in America is substantially a function of exogenous forces of globalization and technological change, there is little individuals can do to bolster their feelings of autonomy and competence. They may therefore focus on relatedness. One way to bolster their feelings of relatedness is by affiliating with salient identity groups such as race and nation. Similarly, theories of so-called “worldview defense” (WDT) argue that when people feel worried they will double-down on their in-group affiliations (Holbrook et al. 2011). In laboratory studies these typically overlap with broad identity markers like race and nation. Both literatures imply that economic decline, through its pernicious effect on psychological wellbeing, could encourage in-group bias. We argue that Trump, with his “America First” and “Build a Wall” policies and his nativist rhetoric, fueled and harnessed these sentiments to secure the Presidency.

Honing our hypothesis, a key inference of SDT and WDT is that in-group bias is more likely to manifest as identification with a broad group like race or nation when more intimate sources of group identification, like a church group or sports club, are unavailable. Sociologists have long noted that small, local sources of in-group identity, like bowling leagues and trade unions, have declined precipitously across America in recent decades (Putnam 2000, 2015). Religious affiliation and church attendance are similarly in free-fall (Pew Research Centre 2019). In line with the inferences of SDT and WDT, qualitative studies of Trump voters have tied this cultural decay to his success (Cramer 2016). A central thesis of Carney’s (2019) Alienated America is that Trump had greater cut through in areas with low levels of social capital and weak social institutions. Similarly, in her study of Tea Party supporters in Louisiana, Hochschild (2016, p. 225) writes that Trump’s “supporters have been in mourning for a lost way of life”. We therefore hypothesize that Trump should be successful in counties with high levels of worry and low levels of relatedness.","May 13, 2020",Brookings Institution,racial prejudice
27,Why Census Is Right to Ask for Racial and Ethnic Data,https://www.brookings.edu/articles/why-census-is-right-to-ask-for-racial-and-ethnic-data/,Peter Skerry,"CLAREMONT—As Americans complete their census questionnaires, it is evident that the objectionable questions are those about race and ethnicity. As a colleague complained about the short form, which is sent out to almost 85% of households, “All the U.S. government wants to know about me is what color I am.” Already surfeited with racial controversy and hostile to race-conscious policies, many Americans are clearly unhappy to find one-quarter of the census short form devoted to race and ethnicity.

Does it make sense to ask these questions when without them the census might obtain higher levels of cooperation? Why do we require the Census Bureau to address head-on what most other government agencies can avoid or at least finesse: inquiring about the racial and ethnic identity of each and every American?

To be fair, the 2000 census is dominated by race and ethnicity because the Census Bureau eliminated almost half the questions that appeared on the 1990 short form, leaving the race and Hispanic-origin questions more prominent than ever.

Yet, not only whites are unhappy with the bureau’s efforts in this regard. African Americans, in particular, cannot forget “the first undercount,” when the 1790 census, as prescribed by the Constitution, counted slaves as three-fifths of a person. Today, minorities, as well as nonminorities, are distrustful of the uses to which census data might be put, despite repeated assurances from the Census Bureau that all responses are strictly confidential. The recently renewed controversy over the bureau’s involvement in the wartime internment of mainland U.S. Japanese further fuels distrust among minorities, which is clearly one reason why disproportionate numbers of them do not get counted in the first place.

The bureau is in an awkward position when justifying its gathering of racial and ethnic data. One possible rationale is that such information has always been collected, starting back in 1790. But, again, this history hardly reassures minorities.

A more frequently heard rationale is that the Census Bureau is merely collecting the data necessary to administer the laws of the land. But this is not very satisfying to the many Americans who object to the race-conscious orientation of many of these laws. Never mind the irony that the census itself functions unlike affirmative action. Think about it. If a student identifies herself as a minority on a college application, she improves her chances of admission. Yet, identifying as a minority on the census form offers no such direct benefits, which is one reason why there is a minority undercount.

The bureau’s favored rationale is to emphasize the self-interest of all Americans in obtaining a complete count to maximize their communities’ federal funds and legislative representation. But this is pretty weak stuff. It is obviously unclear to many Americans that they will benefit individually from filling out the forms. As the affirmative-action example highlights, many minorities do not believe so, or at least they don’t believe any such benefits to their group or community outweigh the risks to themselves individually from cooperating with the census. Besides, the more the Census Bureau stresses self-interest to minorities, the more disaffection this generates among nonminorities upset about race-conscious policies.

Is there a solid reason to ask Americans about their racial and ethnic identities on the census? Yes. But first we need to be more realistic about what to expect from census data. Minority advocates and their allies need to recognize that while the minority undercount is real, its consequences—fiscal as well as electoral—have been grossly exaggerated. After all, not being counted in the census is regrettable and arguably has some impact on minority legislative districts, but it hardly deprives minorities of their real source of power: the franchise.

On the other hand, Americans disaffected with race-conscious policies need to understand that it is not the census that is causing dissension over race in the United States. The census is merely the messenger. If Americans are upset with affirmative action and similar policies, they should, as they have, attack these policies, not the census.

We have all gotten caught up in the notion that demography is destiny. But census numbers are just not as important as what policymakers do with them: whether drawing district lines, constructing funding formulas or setting affirmative-action goals. As Rep. Barney Frank (D-Mass.) once put it: “How many members of the National Rifle Assn. are there? I don’t know. I don’t think my colleagues know. What’s important, politically, is not how many there are, but what you do about it. The extent to which you mobilize enormously outweighs the numbers.”

Those who think the bureau’s multiracial option on the 2000 form is evidence that the entire scheme of counting by race is about to collapse of its own complexity are deceiving themselves. Race and ethnicity are real, if frequently misunderstood, forces in American life. Whatever the future of the multiracial option, race is not about to disappear from U.S. politics.

Finally, those most disaffected with the national discourse on race need to realize that data gathered by the census are their best weapon in arguing against policies they find objectionable. If, for example, minority advocates downplay racial progress, census data will help make the case against them. To be sure, those advocates will also rely on the data to make a case.

That’s the point. Racial and ethnic data from the census allow each of us, individually or as members of groups or organizations, to make self-interested or partisan arguments. This is not always a pretty sight. But, over time, census data used in this way allow us to assess racial progress—or lack of it. The alternatives to the collection of racial and ethnic data by the census are ignorance, malice, paranoia, opportunism and prejudice, of which there is already an abundance across the political spectrum.","April 16, 2000",Brookings Institution,racial prejudice
28,Why are states banning critical race theory?,https://www.brookings.edu/articles/why-are-states-banning-critical-race-theory/,"Rashawn Ray, Alexandra Gibbons","Fox News has mentioned “critical race theory” 1,300 times in less than four months. Why? Because critical race theory (CRT) has become a new bogeyman for people unwilling to acknowledge our country’s racist history and how it impacts the present.

To understand why CRT has become such a flash point in the culture, it is important to understand what it is and what it is not. Opponents fear that CRT admonishes all white people for being oppressors while classifying all Black people as hopelessly oppressed victims. These fears have spurred school boards and state legislatures from Tennessee to Idaho to ban teachings about racism in classrooms. However, there is a fundamental problem: these narratives about CRT are gross exaggerations of the theoretical framework. The broad brush that is being applied to CRT is puzzling to academics, including some of the scholars who coined and advanced the framework.

CRT does not attribute racism to white people as individuals or even to entire groups of people. Simply put, critical race theory states that U.S. social institutions (e.g., the criminal justice system, education system, labor market, housing market, and healthcare system) are laced with racism embedded in laws, regulations, rules, and procedures that lead to differential outcomes by race. Sociologists and other scholars have long noted that racism can exist without racists. However, many Americans are not able to separate their individual identity as an American from the social institutions that govern us—these people perceive themselves as the system. Consequently, they interpret calling social institutions racist as calling them racist personally. It speaks to how normative racial ideology is to American identity that some people just cannot separate the two. There are also people who may recognize America’s racist past but have bought into the false narrative that the U.S. is now an equitable democracy. They are simply unwilling to remove the blind spot obscuring the fact that America is still not great for everyone.

Scholars and activists who discuss CRT are not arguing that white people living now are to blame for what people did in the past. They are saying that white people living now have a moral responsibility to do something about how racism still impacts all of our lives today. Policies attempting to suffocate this much-needed national conversation are an obstacle to the pursuit of an equitable democracy. Supporters of CRT bans often quote Martin Luther King Jr’s proclamation that individuals should be viewed by the content of their character instead of the color of their skin, ignoring the context of the quote and the true meaning behind it.

To better understand how widespread these efforts are to ban critical race theory from U.S. classrooms, we did an assessment of anti-CRT state legislation. Here’s what we found:

The approach of some Republican-led state legislatures is a method for continuing to roll back racial progress regarding everything from voting rights to police reform. This is a horrible idea and does an injustice to our kids. Laws forbidding any teacher or lesson from mentioning race/racism, and even gender/sexism, would put a chilling effect on what educators are willing to discuss in the classroom and provide cover for those who are not comfortable hearing or telling the truth about the history and state of race relations in the United States. Ironically, “making laws outlawing critical race theory confirms the point that racism is embedded in the law,” as sociologist Victor Ray noted.

Some parents are worried about their kids learning things in school that they do not have the capacity to address. As a college professor who does teach CRT as one of the many theoretical frameworks that I bring into the classroom, students are alarmed by how little they have learned about inequality. They are upset at their schools, teachers, and even their parents. So, this is the conundrum: teachers in K-12 schools are not actually teaching CRT. But teachers are trying to respond to students asking them why people are protesting and why Black people are more likely to be killed by the police.

Ultimately, we cannot employ colorblind ideology in a society that is far from colorblind. Everyone sees it, whether they acknowledge it consciously or not. As I wrote in a previous Brookings article on whether the U.S. is a racist country, systemic racism can explain racial disparities in police killings, COVID-19, and the devaluing of homes in Black neighborhoods. If we love America, we should want it to be the best it can be. Rather than run from the issue of racism in America, we should confront it head on. Our kids and country will be better for it.

The “Ending Critical Race Theory in D.C. Public Schools Act,” introduced by a representative from Wisconsin, would ban certain concepts from being taught in D.C. public and charter schools.

The “Stop CRT Act” would withhold federal funding from schools and universities that promote “race-based theories.” The Senate passed an amendment to the budget resolution with Manchin’s support blocking federal funding from being used to teach CRT in pre-K and K-12 schools.

The “Protecting Students from Racial Hostility Act” would amend Title VI of the Civil Rights Act of 1964 to make the teaching of “divisive concepts” discriminatory, establishes a system for reporting related complaints.",November 2021,Brookings Institution,racial prejudice
29,A revolution of values for Black American families,https://www.brookings.edu/articles/a-revolution-of-values-for-black-american-families/,Andre M. Perry,"When talking about Black American families, we’ve all heard someone say this not-so-subtle dig: It all starts at home. The phrase suggests that if we could just fix Black mothers and fathers to be responsible like white, middle-class families, we wouldn’t have any problems.

False narratives such as this one help normalize a hierarchy of human value that leads to an investment into whiteness. Since the Moynihan Report was published in 1965, researchers and journalists have continued framing poverty mainly as a function of individual choices. The report offered a robust structural analysis, but it set a dangerous precedent by identifying Black people not living up to white middle-class ideals as a central problem. This falls in line with the white supremacist myth claiming that harsh conditions in many Black communities are the result of Black people’s collective choices and moral failings.

One of the major goals of my new book, Know Your Price: Valuing Black Lives and Property in America’s Black Cities, is to show that there is nothing wrong with Black people that ending racism can’t solve. Presumptions of Black people’s unworthiness undercut efforts to invest in Black-majority neighborhoods. There’s a whole lot of programs and research that attempt to fix Black people, and not enough focused on fixing structural racism. Until we rid ourselves of these underlying assumptions found between the lines of our research, policy recommendations, and reforms, we will always do more harm than good.","May 22, 2020",Brookings Institution,racial prejudice
30,How a Minneapolis public history project is building political will to redress racial housing disparities,https://www.brookings.edu/articles/how-a-minneapolis-public-history-project-is-building-political-will-to-redress-racial-housing-disparities/,"Kirsten Delegard, Danya Leebaw","Before Minneapolis became the epicenter of an international movement for racial reckoning, its residents faced the kind of everyday racial injustices that rarely make headlines. The Twin Cities metro area, for instance, has the largest racial homeownership gap in the country. While 70% of white families own their homes, only 21% of Black families can say the same. Our metro area’s racialized housing crisis has been the subject of research reports for decades, but little has changed.

To highlight the deeply rooted causes behind these disparities, in 2019, the University of Minnesota Libraries hosted the premiere of “Jim Crow of the North,” a film that tells the story of how racial covenants came to Minneapolis in the 20th century and why these racist restrictions laid the foundation for contemporary housing inequities. Filmmaker Daniel Bergin chose this location for the debut because since 2016, we had been the incubator for an experiment aimed at building political will to address racial housing inequities: Mapping Prejudice, which the film also followed the origins of. Mapping Prejudice mobilizes community members to identify racial covenants and visualize their lasting impact on the city’s physical landscape.

In this piece, we highlight how academic libraries can foster new spaces for dialogue around racial justice and housing access through community-centered projects like Mapping Prejudice, while also leveraging their resources, data, and community connections to translate this dialogue into action.

Mapping prejudice mobilizes volunteers to visualize the hidden histories of race and privilege in the built environment. It was inspired by and builds upon similar work in Seattle and Virginia that uses digital mapping to draw linkages between past policies and contemporary racial disparities.

By engaging community members in the creation of a dataset and data visualizations of racist housing deeds, Mapping Prejudice has helped thousands of people see up close what Ibram X. Kendi calls the “racism behind those racial disparities.” Our analysis has drawn new attention not only to the lasting effects of residential racial segregation in Minneapolis, but also to how race has shaped public space in the city—with some of the city’s best parks located in residential districts that barred people of color from living there.

Over the years, these visual representations have helped residents make meaning of historical data and foster new understandings of how racial segregation was established in Minneapolis, how race shaped housing access, and how wealth is transferred from one generation to another through property ownership.

Our academic colleagues as well as the broader public are often curious about why Mapping Prejudice’s institutional home is in an academic library. To us, the library makes perfect sense for a justice-oriented public history project like this because of its values and aspirations, even if the gap between these and reality can be significant and problematic. Libraries are committed to openness and collaboration, while public historians are driven to listen and co-create with the community.

Last year, we received transformational funding to usher in the next, crucial phase of Mapping Prejudice: Mapping Trust: A model for co-creative community collaboration in an academic library. With support from the Mellon Foundation, Mapping Trust will create a think tank within the library to nurture conversations—with the voices of Black, Indigenous, and people of color at the center—around dismantling structural racism and developing mutually beneficial collaborations to launch community projects with the same aim.

The Mapping Trust project involves hiring a new full-time community engagement lead and recruiting six community engagement fellows from around the Twin Cities, for work that will begin this summer. This is the first program of its kind in an academic library, although it is aligned with other movements at the University of Minnesota and beyond to bridge the gap between the academy and the surrounding community. The community engagement lead and fellows will have access to resources and support from the project team, the libraries, and the university to pursue meaningful projects with the Mapping Prejudice data for their own smaller communities.

With Mapping Trust, the hope is that the University of Minnesota Libraries can help lead a movement through which an academic library can enact its stated values of being open, serving the public good, and working for social change.","May 11, 2022",Brookings Institution,racial prejudice
