Index,Article Title,URL,Author,Content,Date,Think Tank,Matched Keywords
19,Teacher perceptions and race,https://www.brookings.edu/articles/teacher-perceptions-and-race/,Dick Startz,"When it comes to student behavior, what’s polite or rude—what counts as acting out versus what’s seen as healthy youthful exuberance—depends not only on actual behavior but on how teachers read behavior. Black and white American cultures are still sufficiently different in that how teachers read behavior depends in part on the teacher’s race. New research shows that black and white teachers give very different evaluations of behavior of black students. When a black student has a black teacher that teacher is much, much less likely to see behavioral problems than when the same black student has a white teacher.

New research by Adam Wright, “Teachers’ Perceptions of Students’ Disruptive Behavior: The Effect of Racial Congruence and Consequences for School Suspension,” documents that black teachers have much less negative views of black student behavior than do white teachers. (Conflict of interest notice…hmmm no, braggin’ notice: Wright is one of my PhD students.) Wright looks first at teacher evaluations of behavior, and then at data on school suspensions. Let’s begin with the teacher evaluations.

Wright uses data from the Early Childhood Longitudinal Study to follow the experience of more than 20,000 students in kindergarten, first, third, and fifth grade. During the elementary school years, teachers were asked to assess a number of noncognitive skills. The measure of interest here is “externalizing problem behaviors,” which asks how often the student “argues, fights, gets angry, acts impulsively, and disrupts ongoing activities.” Notice that we see a measure of teacher perception, rather than counts of disciplinary events. Wright focuses on externalizing behavior because this measure is highly correlated with school suspensions.

On a scale in which the average measure of externalizing behavior is normalized to zero, white and Hispanic students average -0.07, while black students average +0.37. (Asian students average -0.38.) So on average, black students are viewed as having much worse behavior—which presumably reflects some combination of objectively worse behavior and perceived worse behavior.

Wright does something very clever, taking advantage of the fact that students are observed several times and that we know which students are in which classes with which teachers. Wright asks how black students are rated by black teachers, controlling for both the average rating of an individual student by all his teachers and for the average rating a particular teacher of all of her students in a given class. What this means is that Wright can identify how a black student’s behavior is perceived by a black teacher as compared to how the same student is perceived by white teachers. The procedure also adjusts for the possibility that black teachers are just more “easy going,” because the average rating given in a class is effectively subtracted off. So Wright is arguably identifying a causal effect of black students being matched with black teachers.

Bottom line: black teachers are much less likely to find problems with black students than white teachers are with the same students. The difference is enormous, accounting for about half the black/white externalizing behavior gap. (Remember that the data does not tell us whether black teachers have different perceptions of black students or whether student/teacher race matching leads to objectively different behavior.) For black students, being matched with a black teacher matters.

How about white or Hispanic students being matched with white or Hispanic teachers, respectively? Nope, no discernable differences in externalizing behavior. (To be clear, black teachers rate white students about the same as do white teachers.) In other words, being race matched matters a lot for black students but not for others.

Wright drills down further. First—and this is probably unsurprising—the effect of race matching is entirely due to the evaluations given to black boys. There isn’t a noticeable difference for black girls. Second, the effect of matching is limited to the year of the match. When Wright checked reports of black students when they were assigned to white teachers following a year with a black teacher he found no lingering effects of that year of being race-matched. This suggests that the findings reflect teacher perceptions rather than real behavioral differences since we might expect improvements in behavior to persist the following year—and that’s not what happens.

Wright then turns to the question of suspension. As is well known, black students are much more likely to be suspended than are white students. Wright shows that the more times a black student is matched with a black teacher, the less likely that student is to be suspended. Unfortunately, the data does not note the grade in which a suspension happened. It is reasonable to speculate that most suspensions come in later grades and that the finding is due in part to the effect of student-teacher race matching in earlier grades. We can’t be sure of this however, and some part of the finding may also be due to fewer suspensions of black students during years they have black teachers.

The difference in suspension rates is large. Taking these findings at face value, Wright estimates that if we doubled exposure of black students to black teachers, the black-white suspension gap would fall in half. Because of data limitations, it’s not possible to test whether black students’ likelihood of suspension changes when they move from a black teacher to a white teacher. Instead, Wright looks at black students who enter the same school at kindergarten but are exposed to different percentages of black teachers through eighth grade. So the causal interpretations about suspensions are less certain than are the interpretations about behavior reports.

In summary, black teacher perceptions about the behavior of black boys is very different than the perceptions of white teachers. This doesn’t happen for other racial groups. None of this necessarily suggests malice or prejudice or favoritism on anyone’s part. It does suggest one more way that race still matters in our schools.","February 22, 2016",Brookings Institution,racial prejudice
20,Should the government play a role in reducing algorithmic bias?,https://www.brookings.edu/events/should-the-government-play-a-role-in-reducing-algorithmic-bias/,N/A,"On March 12, the Center for Technology Innovation hosted a panel discussion on how governments can address the problem of bias in algorithms. Alex Engler, a Brookings Rubenstein Fellow, asked about the elusive definition of fairness—and how to get there in artificial intelligence and other algorithms. Experts Ghazi Ahamat, Lara Macdonald, and Adrian Weller from the U.K.-based Centre for Data Ethics, and Nicol Turner Lee, director of the Brookings Center for Technology Innovation, gave their answers, thoughts, and suggestions.

Algorithmic bias is not an imaginary or theoretical notion. In industry and government, algorithms that provision healthcare, assist with hiring, direct police, and determine creditworthiness have exhibited differential treatment and disparate impact on similarly situated people, places, and objects. In recent years, examples have emerged of models of human language that manifest a bias against women and people with disabilities; the accuracy of some prominent speech recognition and facial recognition algorithms are skewed against African Americans. Even when unintended, algorithmic bias can arise from reliance on unrepresentative training data or prejudiced historical data or from failing to address statistical biases. In some cases, algorithmic bias is not only unethical, but could also result in illegal discrimination. But the trajectory of this emerging technology need not be negative. Government will play a key role in reducing algorithmic bias, both as a consumer and a regulator, to harness algorithms as a means for efficiency and positive change.

As a consumer of algorithms, governments have large market power and control over many important algorithmic use cases. In this role, governments can set standards, provide guidance, and highlight practices to reduce algorithmic bias. The public sector should gain the public’s confidence in algorithmic use cases before deployment and disclose use of algorithms in decisions that significantly affect individuals. In the U.K., all agencies have a non-delegable duty to document anticipated and potential algorithmic discrimination prior to use. Like every policy decision, use of algorithms should be evaluated with impact assessments. Real world performance across demographic groups should be analyzed, since algorithms and inferences about data can lead to unexpected and unintended outcomes. Public sector use should balance locality-specific needs with a consistent national approach. As a best practice, public sector applications should collect data about race, sexual orientation, and similar categories when possible to monitor for bias, as U.K. law explicitly allows.

Criminal justice algorithms have large impacts on individuals’ lives, and governments should take care to get them right. Policing algorithms are not in widespread use in the U.K., but are being considered. Governments must remember that “predictive policing predicts policing, not crime.” For instance, in the U.S., Black and white individuals use drugs at approximately the same rates, but Black individuals are far more likely to be arrested and convicted. Algorithms based on data from past actions of police likewise predict policing, not crime, and may be biased. However, these algorithms can be adjusted; “bias in” does not always mean “bias out.” As governments roll out risk assessments to predict, among other things, recidivism rates of defendants in criminal trials, judges must learn the information and process that risk assessments use so they can place appropriate weight on the outputs. Some localities in the U.S. have banned certain criminal justice algorithms, particularly law-enforcement facial recognition algorithms. While understandable, this approach disregards possible efficiencies and ignores the prevalence of comparable technology in industry. Instead, governments should try to set guardrails to reduce the bias in criminal justice algorithms.

In the U.K., regulators should adapt existing frameworks to incentivize ethical algorithms. Antidiscrimination as a legal requirement has a strong basis in the U.K. Equality Act of 2006, the Human Rights Act of 1998, and sector-specific antidiscrimination laws, such as those in finance and policing. The U.S. likewise has non-discrimination, civil rights, and sectoral laws that must be updated and connected to the digital world. U.K. data protection law, including the U.K. General Data Protection Regulation (GDPR), allows people to opt out of fully automated decisions, though some fine-tuning is needed. Unlike the U.K. the U.S. does not have a comprehensive federal privacy law, and therefore has no comparable baseline for basic digital rights like opt-out of automated decisionmaking. Finally, algorithms should disclose their errors so human oversight can accompany them in appropriate contexts.

The process of checking algorithmic bias will be a cycle of identifying algorithmic requirements, researching how to build compliant algorithms, and then enforcing those requirements. Nascent compliance and risk assurance tools can emulate other industries: For compliance, governments can use verification, audit, certification, and accreditation tools; for risk, impact assessments, audits, and ongoing testing. Requirements will vary by industry and context; for instance, in environments with high uncertainty and variation, some disparate impact may be tolerable, but in others it must be rigorously avoided. Guidelines must combine principles with precise thresholds. Algorithms need a basic fairness test (of which there are many mutually incompatible options) to avoid extreme disparate impact. Guiding principles can prevent discrimination in important contexts that may be overlooked by assessments of disparate impact. To develop and enforce regulations, governments must also develop their technical expertise.

Algorithms may exist in environments that are already unfair, and governments must consider working with companies (and similar organizations) to move forward productively in these scenarios. When a company tries to increase fairness but still ends up with a biased algorithm, resorting to human decisionmaking may not solve the problem. As a concrete example, Amazon trained an algorithm on historical, human-based hiring data that ultimately created a sexist algorithm. Even though the algorithm was biased, the human decision-makers were also biased. Creating an ethical algorithm is often easier than mitigating human biases. Society must decide what role algorithms play in correcting societal inequity, and emerging research in AI fairness can help reach that goal.

In the past, technological cadence has been prioritized over fairness; now it is time to shift that balance and take steps to reduce algorithmic bias. Deploying algorithms without establishing guardrails, appropriate trainings, or procedures—without considering politics—causes problems.

To learn more, explore literature from the Center for Data Ethics and Innovation, including the report that inspired many of today’s conversation topics, and the Brookings Artificial Intelligence and Emerging Technologies Initiative.","Friday, March 12, 2021",Brookings Institution,racial prejudice
