Index,Article Title,URL,Author,Content,Date,Think Tank,Matched Keywords
11,Was it Tragedy in Tucson? Or Terror?,https://www.brookings.edu/articles/was-it-tragedy-in-tucson-or-terror/,Daniel L. Byman,"When Jared Lee Loughner allegedly shot Rep. Gabrielle Giffords in the head and then began firing into a crowd gathered in a grocery story parking lot in Tucson, was it tragedy? Or was it terrorism?

Most news outlets have gone with “Tragedy in Tucson,” not asking whether the shootings were a terrorist act. Some government officials, however, are at least raising the issue. FBI Director Robert Mueller has not ruled out charging Loughner with terrorism, and Secretary of State Hillary Rodham Clinton referred to the shooting when speaking in Abu Dhabi last week. She said that “we have extremists in my country” and urged countries around the world to cooperate against violence.

Terrorism is like pornography – people know it when they see it. One of the modern pioneers of the study of terrorism, Brian Jenkins, once wryly observed: “Terrorism is what the bad guys do.” This notion still holds true, and the result is both the overuse and the underuse of the “terrorist” label.

Getting it wrong is risky. One of the first Sunni-jihadist-linked attacks in the United States was the 1990 murder of extremist rabbi Meir Kahane, who founded the Jewish Defense League. El Sayyid Nosair was charged with the murder, but the attack was treated as a simple crime, and Nosair escaped conviction. He went on to try to kill thousands of people as part of the 1993 attempt to bomb the World Trade Center.

An obscure Saudi named Osama bin Laden helped pay for Nosair’s legal defense in the Kahane trial, but the narrow focus on the crime led prosecutors to ignore the broader conspiracy of which the defendant was a part. Nosair was later convicted in the World Trade Center bombing on charges that included “seditious conspiracy” and racketeering, legal tools that prosecutors have used to go after terrorists. The conspiracy in this case included the Kahane murder. It was only after terrorism came into play that Nosair met justice.

The overuse of the “terrorism” label is even more dangerous. Terrorist attacks, by design, foster fear, and if we blame terrorists whenever blood spills, we artificially make the perpetrators stronger. A terrorism charge also brings broader national security concerns to any act of violence, possibly leading to more restrictions on civil liberties. And while foreign terrorists unite Americans in defiance, political violence at home can divide us. Already both pro- and anti-gun voices are lining up to spin Loughner’s alleged deeds, and former vice presidential candidate Sarah Palin has accused her political opponents of manufacturing a “blood libel” against her with criticism of some of her rhetoric. In this climate, saying that Loughner is a terrorist implies that the pro-gun side is not simply wrong, but moreover a threat to the security of the United States.

In an era when racial profiling has become part of the terrorism debate, the label also may come more easily when the alleged attacker conforms to common prejudices about what a terrorist looks like. Suppose Loughner had a Muslim-sounding name, even though he acted alone and had a history of mental illness. What might we be saying then?

To fight terrorism, we have to understand it, and to understand it, we must know what it is and what it isn’t. That’s why experts have worked hard to define it. Analysts, led by my colleague Bruce Hoffman, have laid out criteria to judge whether an act of violence should be called terrorism. Although there is no consensus, common factors include: 1. Was the motive political? 2. Did the attacker seek to influence a broader audience? 3. Did it involve an organized group (not a lone wolf)? 4. Did it target civilians? 5. Was it carried out by a non-state actor – that is, a person or persons outside the government?

Let’s start with a political motive, which is often what separates terrorism from straightforward crime. The guy who kills the clerk in a 7-Eleven robbery gone wrong is not politically motivated and thus not a terrorist. On the other hand, a political motive alone doesn’t merit the terrorist label. Some disturbed individuals or criminals do have political views and attack political targets, but calling them terrorists conflates madness with the calculated evil and broader ambitions of someone like bin Laden. John Hinckley Jr., who tried to kill President Ronald Reagan, had a political target; he did not care about Reagan’s policies, though, but was trying to impress the actress Jodie Foster. Nor did Hinckley seek a broader psychological effect. He was not attempting to influence voters or otherwise intimidate or inspire. So the shooting of the ultimate political target was not terrorism.

Whether to include lone wolves is also tricky. Timothy McVeigh, the Oklahoma City bomber, did not belong to an organized group. Yet he swam in a larger sea of militia and right-wing radicalism, and while he did not receive assistance from these groups, they did inspire him. Similarly, Mohammed Bouyeri, who in 2004 killed Dutch filmmaker Theo van Gogh and pinned a note to his victim claiming he’d acted in defense of Islam, is often referred to as a terrorist, even though he acted on his own. Like McVeigh, Bouyeri saw himself as a fighter for a bigger cause.

Terrorists take issue with the “non-state” consideration. They contend that placing a bomb in a marketplace is on the same moral plane as a military air strike that destroys the marketplace. To this we have an answer – military strikes that deliberately target civilians are war crimes, and while they are not always prosecuted, we have laws against them. Calling terrorism a war crime elevates terrorists to the status of legitimate combatants, giving them the standing they crave.

Perhaps the most complex issue involves who is a civilian. At first, this seems pretty clear: No soldiers were deployed in the twin towers on Sept. 11, 2001, and the bombs that go off in marketplaces in Iraq clearly seek to hit noncombatants, not warriors. Yet think about al-Qaeda’s attack in 2000 on the USS Cole, which killed 17 U.S. sailors. To most Americans, it looks, sounds and smells like terrorism. But the 17 sailors crewed a guided-missile-equipped destroyer – not exactly a pleasure boat. Their killers are America’s enemies, but the sailors were not civilians in the way that Giffords and those near her were. As one military student of mine put it, “I don’t want to get shot at, but I’d rather they go after me than some civilian at home.”

So is Loughner a terrorist? Allegedly, he used violence, he did not act on behalf of a state, and he struck at civilians. But then the ambiguities come in. It is not clear whether he wanted to influence a wider audience, and his alleged actions appear to have been taken alone.

The biggest reason to avoid labeling this clearly disturbed young man as a terrorist is his political agenda – or lack thereof. Through his YouTube video postings and in interviews with people who knew him, the portrait of Loughner that emerges is one of a man mouthing off at the government, declaring: “I won’t pay debt with a currency that’s not backed by gold and silver!”

But he is more alienated poseur than true believer in any cause. He derides Giffords as “fake,” language more reminiscent of Holden Caulfield than Ayman al-Zawahiri. His behavior is reported as erratic. He warns about government mind control and seeks to live in his own dream world, which he believes he can manipulate like a character in “The Matrix.” His favorite books included “Mein Kampf” and “The Communist Manifesto,” favorites of right- and left-wing terrorists, respectively. But even fanatics, not known for their intellectual depth, recognize that the two works don’t go together. One of Loughner’s friends declared that he had no political or ideological bent, likening him to the Joker in the most recent Batman movie: “There’s no rhyme or reason; he wants to watch the world burn.”

Americans are mystified and mourning after the shootings in Tucson a week ago. There’s no good way to explain why Loughner allegedly did what he did. But there is a way to categorize it: tragedy in Tucson, not terror.","January 14, 2011",Brookings Institution,racial prejudice
12,"Biden State of the Union 2023: Biden has good news, but Americans are in a bad mood",https://www.brookings.edu/articles/biden-state-of-the-union-2023-biden-has-good-news-but-americans-are-in-a-bad-mood/,Elaine Kamarck,"Like presidents before him, Joe Biden will almost certainly focus his State of the Union on his accomplishments and on good news. The lowest unemployment rate in 52 years? That will certainly make the list. Inflation coming down? You bet. The public health emergency ending in May? Finally. Manufacturing returning to the United States. Passage of the CHIPS bill so that the U.S. will not be vulnerable to shortages of computer chips, or vulnerable to supply disruptions in the future. The Infrastructure Investment Act which will make the airports sleeker and the roads safer. The Inflation Reduction Act providing money to finally tackle climate change.

And yet Americans are in a really sour mood. An NBC poll asked voters whether America was on a right track or on a wrong track and found that in eight out of nine recent polls over 70% of voters declared America on the wrong track. The most recent poll found that 71% of Americans believe the nation is on the wrong track. “The NBC News’ poll has never before recorded this level of sustained pessimism in the 30-year-plus history of the poll.” This pessimistic mood is found in other polls as well. For instance, Pew found that 78% of Americans were dissatisfied with the direction of the country.

Why? There are, of course, many possible reasons. As Bill Galston and I have written before in these pages, inflation is a particularly tough political problem. Voters are reminded of it every day and the cure (recession) is usually worse than the disease. Decades of low trust in government makes citizens reluctant to believe that government spending can fix many problems. Though fading, the pandemic has left a trail of disruption in its wake. The spike in violent crime has left many citizens feeling unsafe in their own neighborhoods.

America is changing and change makes people uncomfortable. Many Americans complain that they no longer recognize their country. Not all of them are white nationalists or racists; many are just uncomfortable with the changes they have seen in their lifetimes. America is no longer an overwhelmingly white, Christian nation.

At the beginning of the 20th century—1910—88.1% of U.S. citizens were white. Over the next seventy years that number dropped slowly to 79.6% (down 8.5%). But in the next forty years, from 1980 to 2020, the proportion of the population that is white dropped much more rapidly, by 20.8 percentage points. By the 2020 election only 58.8% of the population was white.

“Most noteworthy is the increased diversity in the younger portion of the population. In 2019, for the first time, more than half of the nation’s population under age 16 identified as a racial or ethnic minority. Among this group, Latino or Hispanic and Black residents together comprise nearly 40% of the population. Given the greater projected growth of all nonwhite racial minority groups compared to whites—along with their younger age structure—the racial diversity of the nation that was already forecasted to flow upward from the younger to older age groups looks to be accelerating.”

The diversifying of America has important political and market consequences. While many in these minority groups are still mired in age-old cycles of poverty, prejudice, and powerlessness, others are coming of age and assuming leadership positions. We’ve had a Black president and a Black female vice president and a Black female Supreme Court justice. Equally unnerving to many Americans is the appearance of more and more minorities in commercials. Ad-makers are not interested in political correctness. They are interested in building future market share for their product, whether it’s butter or cars.

Older Americans look at younger generations and don’t see themselves. And the younger generations look at many of the people in leadership positions and wonder why these old white guys are still in charge. No wonder that, in a country where things are going pretty well, the population is wallowing in pessimism, with members of each party convinced that the other is out to destroy the America they know. Non-white Americans are generally more optimistic and see the country on a better track than white Americans, yet both groups share a general pessimism towards the future.

There is no policy fix to this problem; it is fundamentally a problem of generations and of cultures. Politicians can try to soften the rough edges, as Biden will try to do, or exacerbate the fear of change, as Trump has done and continues to do. But until this cycle of change is complete two visions of America will coexist locked in pessimism.","February 3, 2023",Brookings Institution,racial prejudice
